{
  "schema_version": "sys4ai.plan-task-envelope.v2",
  "plan_id": "PLAN-EXAMPLE-001",
  "plan_sha256": "aaaaaaaaaaaaaaaaaaaaaaaaaaaaaaaaaaaaaaaaaaaaaaaaaaaaaaaaaaaaaaaa",
  "task_id": "TASK-002",
  "task_sha256": "2222222222222222222222222222222222222222222222222222222222222222",
  "generation": 2,
  "handoff_token": "example-token-not-secret-000000000000000000000000",
  "idempotency_key": "PLAN-EXAMPLE-001:2",
  "predecessor_thread_id": "EXAMPLE-THREAD-001",
  "repository_binding": {
    "root": "<PROJECT_ROOT>",
    "worktree": "<PROJECT_ROOT>",
    "branch": "<TARGET_BRANCH>",
    "starting_revision": "<STARTING_REVISION>",
    "environment_mode": "local"
  },
  "activation_receipt_sha256": "b14de7dc625e2edbe31dd1cf589204947245e9c339f4161ee5b30207f4c33eb7",
  "execution_profile": {
    "schema_version": "sys4ai.plan-execution-profile.v1",
    "activation_id": "PAR-EXAMPLE-001",
    "activation_receipt_sha256": "b14de7dc625e2edbe31dd1cf589204947245e9c339f4161ee5b30207f4c33eb7",
    "reasoning_effort": "max",
    "selection_source": "default",
    "accepted_goal_sha256": "837af6509ab28c5268cf58c028c964cfedf62c9676d2d689f696f44f6d4f5715",
    "accepted_plan_sha256": "aaaaaaaaaaaaaaaaaaaaaaaaaaaaaaaaaaaaaaaaaaaaaaaaaaaaaaaaaaaaaaaa",
    "current_thread_id": "THREAD-COORDINATOR-001",
    "current_thread_requested_effort": "max",
    "current_thread_effective_effort": "max",
    "current_thread_verification_status": "verified",
    "current_thread_evidence_ref": "evidence/current-thread-profile.md",
    "successor_inheritance_required": true,
    "provider_id": "codex-app-server",
    "model_id": "gpt-example",
    "effective_from_generation": 1,
    "repository_binding_sha256": "0416fdd9a56ccfc815feb622251d83993fd525434c3a32999bd43c61527c0527",
    "repository_topology_policy_sha256": "908ef39402ab1ba90f7e4227193ef6a8ec7ed68a638957b686ba6464c3e5531e",
    "hash_basis": "canonical_json_without_profile_content_sha256",
    "profile_content_sha256": "c3e07d4c74113a929c0c3d4b782c6a55dbe12f20bf99bef13876163ef177d6d6",
    "finalized": true
  },
  "repository_topology_policy": {
    "environment_mode": "reuse_bound_checkout",
    "branch_creation_authorized": false,
    "worktree_creation_authorized": false,
    "binding_change_authorized": false,
    "authorization_ref": null
  },
  "repository_binding_sha256": "0416fdd9a56ccfc815feb622251d83993fd525434c3a32999bd43c61527c0527",
  "activation_sequence": 1,
  "one_task_per_discussion": true,
  "max_continue_invocations": 1,
  "max_agentjobs": 1,
  "required_skill": "continue-implementing-plan-task",
  "extensions": {}
}
